Company,Website,Lead_Score,Email,Decision_Maker,Employees,Years_Active,City,State,FDA_Certified,CE_Certified,Products,LinkedIn_Company,Perplexity_Segment,Perplexity_City,Perplexity_State,Perplexity_Decision_Makers,Perplexity_Notes
Ortobio,ortobio.ind.br,9.0,licitacao@enfermed.net.br; contato@diplomaciabusiness.com,Antonio Villaca Torres Júnior ஃ,39,25,Maringa,PR,False,False,,https://www.linkedin.com/company/ortobio---industria-e-comercio-de-produtos-ortopedicos/,Orthopedic Devices,Maringá,PR,Michael Robinson - President & Chief Executive Officer,Ortobio Industria e Comércio de Produtos Ortopédicos specializes in manufacturing and commercializing orthopedic medical devices.
Biomecânica,www.biomecanica.com.br,9.0,murillo.cardoso@tkcomercial.com; contato@mixsaudemga.com.br; contato@saudeonline.net,Ana Carolina Pengo,8,13,Jaú,SP,False,False,,https://www.linkedin.com/company/labiomep/,Orthopedic Devices,Jaú,SP,Sônia Pengo - Director (Purchasing and Logistics),"Biomecanica is a Brazilian industry specialized in orthopedic implants, prostheses, surgical instruments, and biomaterials, focused on innovation, quality, and research since 1988."
Bone Surgical,bonesurgical.com.br,9.0,phcomercio@outlook.com,Marcelo Ramalho,80,24,São Paulo,SP,False,False,,https://www.linkedin.com/company/bone-surgical/,Medical Equipment Manufacturing,São José dos Campos,SP,,"Bone Surgical is a medical devices company based in São José dos Campos, SP, Brazil, focused on manufacturing medical equipment."
Starlet Instrumentos Cirúrgicos,www.starlet.com.br,9.0,atendimento@starlet.com.br,Ronaldo Starlet,0,20,,,False,False,Líder fabricação instrumentos cirúrgicos alta qualidade,,Surgical Instruments Manufacturing,,,,"Starlet Instrumentos Cirúrgicos is a leading manufacturer of high-quality surgical instruments, providing precise and reliable solutions for healthcare professionals."
S.I.N. Implant System,www.sinimplantsystem.com,9.0,contato@vebdobrasil.com.br,Felipe Leonard,0,0,São Paulo,SP,False,False,,,Dental Implants,Sao Paulo,SP,Felipe Leonard - President; Michael Robinson - President & Chief Executive Officer,"S.I.N. Implant System develops and produces advanced dental implant technology solutions, focusing on affordable and high-precision products for implant dentistry."
IMPLACIL OSSTEM - MATERIAL ODONTOLOGICO S.A.,http://www.implacildebortoli.com.br/,9.0,contato@ipirangacontabil.com.br,Leandro Rocca,0,0,São Paulo,SP,False,False,Artigos e aparelhos para prótese dentária; Implantes dentais; Instrumentos odontológicos,,Dental Implants,São Paulo,SP,,"Implacil OSSTEM - MATERIAL ODONTOLOGICO S.A. is a leading Brazilian manufacturer of dental implants and related prosthetic components, acquired by Osstem Implant in 2024."
Ortosíntese,ortosintese.com.br,9.0,contato@ints.org.br,Alessandro Napolitano,0,0,São Paulo,SP,False,False,,,Implantes Ortopédicos e Equipamentos Hospitalares,São Paulo,SP,Sebastião Galindo - Founder,"Ortosíntese is a 100% Brazilian company specialized in manufacturing orthopedic implants, prostheses, orthopedic instruments, and hospital equipment, serving both domestic and international markets with over 40 years of experience."
Implacil De Bortoli,www.implacil.com.br,9.0,heliobaek@gmail.com,aluizio canto canto,0,0,São Paulo,SP,False,False,"1° implante osseointegrável Brasil 1988, FDA+CE",,Dental Implants,São Paulo,SP,Aluizio Canto Canto - CEO,Implacil De Bortoli is a pioneering Brazilian manufacturer specializing in high-performance dental implant products and related medical devices.
Conexão Dental,,9.0,,CRISTIANO THOMÁS,0,0,Arujá,SP,False,False,,,Dental Implants,Arujá,SP,,"Conexão Sistemas de Prótese is a Brazilian company specialized in the manufacturing, research, and development of intra and extra oral implants and prosthetic components, recognized as a leader in the national implantodontics market with products backed by over 180 scientific studies."
S.I.N. Sistema de Implante,www.sinimplante.com.br,9.0,contato@shareagencia.com,Felipe Leonard,0,0,São Paulo,SP,False,False,"Uma das maiores indústrias Brasil, +10 anos mercado",,Dental Implants,São Paulo,SP,Denise Domiciano - Quality and Regulatory Affairs Manager; Michael Robinson - President & Chief Executive Officer,"S.I.N. Sistema de Implante Nacional (S.I.N. Implant System) is a Brazilian company specializing in the manufacturing of dental implant systems, headquartered in São Paulo, SP."
A S Technology - TitaniumFix,www.titaniumfix.com.br,9.0,vendas@titaniumfix.com.br,Gustavo Alves,0,0,São José dos Campos,SP,False,False,,,Dental Implants,São José dos Campos,SP,,"A S Technology - TitaniumFix develops high-quality dental implants and related components, focusing on safety, comfort, and innovation with 30 years of experience in implantology."
IMPOL,www.impol.com.br,9.0,impol01@hotmail.com; endonca@hotmail.com; cotacao@primecomercios.com.br,Marco Polisel,0,0,Diadema,SP,False,False,,,Orthopedic Products & Implants,Diadema,SP,Margarete Sasaki - Director,"Impol Instrumental E Implantes Ltda. specializes in the manufacturing and export of orthopedic products and implants, operating from Diadema, São Paulo, Brazil."
Titaniumfix,titaniumfix.com/br,9.0,atadeuborges@gmail.com; atedeuborges@bol.com.br,Gilmar Lopes,0,0,São José dos Campos,SP,False,False,,,Dental Implants,São José dos Campos,SP,,Titaniumfix specializes in the manufacture and sale of dental implants and related products.
Amaral & Cia,amaralecia.com,8.5,,Cristiano Amaral,0,0,Osasco,SP,True,False,,,International Trade and Logistics Services,Osasco,SP,,"Amaral & Cia is focused on quality and excellence in logistics and international trade, specializing in import, export, and distribution of goods across various segments including pharmaceuticals, food, chemicals, and oil-related products."
Factory Instrumental Cirúrgico,www.factorycirurgico.com.br,8.5,info@freehtml5.co,Cristine Almeida,0,30,São Paulo,SP,False,False,"+30 anos mercado, diversas especialidades médicas",,Surgical Instruments,,,,"Factory Instrumental Cirúrgico has been providing high-quality products for various medical specialties for over 30 years, mainly focusing on surgical instruments."
Alfa Med Sistemas,www.alfamed.com,8.5,atendimento@alfamed.com,Luigi Verde,0,20,Lagoa Santa,MG,False,False,,,"Medtech - Medical Equipment (ultrasonography, patient monitoring, life support devices)",Lagoa Santa,MG,"Yasmin Viturino - (Title not explicitly found, assumed key contact); Siele Santos - Quality/Regulatory Affairs Manager; Átila Nunes Velloso - Technical Consultant; Leonardo Silva - Project Analyst; Pedro Campos - Hardware Developer","Alfa Med Sistemas is a Brazilian medical equipment manufacturer that develops ultrasonography, patient monitoring, and life support solutions."
ABC Instrumentos,abcinstrumentos.com.br,8.5,vendas@abcinstrumentos.com.br,Peter Ravichandran,0,10,São Paulo,SP,False,False,,,Surgical and Dental Instruments Manufacturing,São Paulo,SP,,"ABC Instrumentos is one of the main manufacturers of surgical and dental instruments in Brazil, known for quality and modern product lines."
ALLIAGE S.A INDÚSTRIAS MÉDICO ODONTOLÓGICA,www.alliage.com.br,8.5,,Caetano Biagi,0,0,Ribeirão Preto,SP,False,False,Autoclaves; Camas; Esterilizadores; Mesas de exame; Mesas para operação cirúrgica; Aparelhos de raio-x odontológico; Cadeiras de Dentistas; Compressores; Esterilização; Implantes dentais; Instrumentos,,Medical and Dental Equipment Manufacturing,Ribeirão Preto,SP,Samio Leone - CEO; Michael Robinson - President & Chief Executive Officer; Caetano Barros Biagi - Director,"Alliage S.A. Indústrias Médico Odontológica develops, manufactures, and markets equipment and products for the medical and dental sectors, being a leader in Latin America's dental industry with over 75 years of experience and presence in more than 150 countries."
Ad Instrumentos Cirúrgicos,www.adinstrumentos.com.br,8.5,vendas@adinstrumentos.com.br,Diretor na ASCAMAS INSTRUMENTOS CIRURGICOS,8,21,Ribeirão Preto,SP,False,False,"Aço inox, 5 anos garantia",https://www.linkedin.com/company/adinstrumentos/,Surgical Instruments,Ribeirão Preto,SP,Antonio Marcos Sangregorio - Diretor / Sócio-Administrador; Daniel Fabiano Ferreira Dutra - Sócio-Administrador,Manufactures stainless steel surgical instruments with a 5-year warranty against manufacturing defects.
Atrasorb,www.atrasorb.com.br,8.5,,Carlos A Campos Campos,40,36,São Roque,SP,False,False,,https://www.linkedin.com/company/atrasorb-industria-de-produtos-hospitalares/,Medical Equipment Manufacturing - CO2 Absorption Technology,São Roque,SP,,Atrasorb is a Brazilian company specializing in high-performance CO2 absorbents for medical applications such as inhalation anesthesia and also serves military and industrial markets with specialized canisters.
Dentoflex,www.dentoflex.com.br,8.5,,Vladimir Berjozov,79,49,,,False,False,Equipamentos e materiais odontológicos,https://www.linkedin.com/company/dentoflex-sistema-de-implantes/,Dental Equipment and Accessories,,,,"Dentoflex is a company involved in the dental sector, likely providing dental equipment or related products, based on context but specific details about the company's Brazilian headquarters, decision makers, or exact segment profile were not found in the available search results."
Artigos Odontológicos Clássico,www.classico.com.br,8.5,,Rafael Tiago Patzlaff,8,67,São Paulo,SP,False,False,,https://www.linkedin.com/company/cl%C3%A1ssico/,Dental Materials and Supplies,São Paulo,SP,,"Artigos Odontológicos Clássico Ltda. is a manufacturer of a comprehensive line of products for the dental industry, active since 1958, focused on quality and innovation in odontological materials."
Ortomedic,ortomedic.com.br,8.5,comercial@ortomedic.com.br,Tonimar Francisco Pereira,61,34,São Bernardo do Campo,SP,False,False,,https://www.linkedin.com/company/ortomedic-group/,Orthopedic Devices,São Bernardo do Campo,SP,,"Ortomedic is focused on the import and distribution of orthopedic implants, offering solutions in trauma, orthopedics, prostheses, spine, and orthoses to ensure quality and patient well-being."
Unitec Hospitalar,www.unitec-hospitalar.com.br,8.5,vendas@unitec-hospitalar.com.br,Antonio Amaro,0,0,São Paulo,SP,False,False,,,Hospital Equipment,São Paulo,SP,,"Unitec Hospitalar manufactures medical-hospital products and equipment, including items like nylon lids with gas identification painting and autoclavable bottles."
ENGIMPLAN ENGENHARIA DE IMPLANTE INDÚSTRIA E COMÉRCIO LTDA,www.engimplan.com.br,8.5,gerencia.swkq@esaero.com.br; ericson.ferreira@materialise.com; contato@healthways.com,Thaís de Paula Busquim,0,0,Rio Claro,SP,False,False,Instrumentos cirúrgicos; Ortopédicos,,Orthopedic Implants,Rio Claro,SP,,"Engimplan Engenharia de Implante Industria e Comercio Ltda is a Brazilian company that develops, produces, and distributes orthopedic implants and surgical instruments across several lines including bucomaxillofacial, spine, ligament, and trauma."
ICONACY ORTHOPEDIC IMPLANTS INDÚSTRIA E COMÉRCIO DE PRODUTOS MÉDICO HOSPITALARES LTDA,www.prosintese.com.br,8.5,,Fabio MÔNACO,0,0,Cotia,SP,False,False,Bombas de infusão; Instrumentos cirúrgicos; Ortopédicos,,Orthopedic Devices,Cotia,SP,Thomas Allen - President; Michael Robinson - President & Chief Executive Officer,"ICONACY operates in the orthopedic prostheses and implants segment, developing, producing, and marketing orthopedic implants with a focus on patient mobility, comfort, and safety, using advanced digital technologies and certified raw materials."
Pross Implantes,www.pross.com.br,8.5,,Rene Regnat,0,0,Ribeirão Preto,SP,False,False,Implantes dentários,,Dental Implants,Ribeirão Preto,SP,,Pross Implantes specializes in manufacturing dental implants made of titanium Grade IV intended for oral rehabilitation treatments.
BIO ENGENHARIA E INDÚSTRIA DE IMPLANTES ORTOPÉDICOS LTDA,http://bioengenharia.com.br/,8.5,melolivia@gmail.com,Ana Cecília Costa,0,0,São Leopoldo,RS,False,False,Instrumentos cirúrgicos; Ortopédicos,,Orthopedic Devices,São Leopoldo,RS,,Bio Engenharia works on the development of high-quality orthopedic implant products aimed at restoring or improving mobility for people with orthopedic restrictions.
Factory Instrumental,factorycirurgico.com.br,8.5,info@freehtml5.co,Eric Pratt,0,30,São Paulo,SP,False,False,,,Medical Surgical Instruments,São Paulo,SP,,Factory Instrumental Cirúrgico specializes in the manufacturing and commercial distribution of surgical instruments.
Pró-Hospitalar,prohospitalar.com.br,8.5,comercial@prohospitalar.com.br,Probo Hospitalar,0,35,Belo Horizonte,MG,False,False,,,Hospital Equipment and Surgical Instruments,,,,"Pró-Hospitalar has been providing high-quality surgical instruments and implants since 1988, specializing in general surgery, neurosurgery, orthopedics, and spinal surgeries, including preventive and reconstructive maintenance services."
Gnatus,www.gnatus.com.br,8.0,contato@gnatus.com.br,Alexandre Queiroz,308,49,Ribeirão Preto,SP,False,False,Equipamentos odontológicos,https://www.linkedin.com/company/gnatus-equipamentos-odontologicos/,Dental Equipment Manufacturing,Ribeirão Preto,SP,,"Gnatus is a Brazilian company founded in 1976 that develops, manufactures, and markets dental equipment, including dental chairs, suction systems, and imaging devices."
Abimade,abimade.com.br,8.0,cavalli.medicamentos@gmail.com,Wilson Rosa,16,15,São Paulo,SP,False,False,,https://www.linkedin.com/company/abimadeprodutosmedicos/,High-End Décor Furniture,São Paulo,SP,,"Abimad is the Brazilian Association of High-End Décor Furniture Industries, promoting luxury furniture and home decor through fairs and export encouragement programs."
Systhex Implantes,www.systhex.com.br,8.0,contato@systhex.com.br; contato@odontologiadigital.com.br; contato@systhexportugal.com,Juliana Silva,0,0,Curitiba,PR,False,False,"Fundada 2003, linha completa, custo-benefício",,Dental Implants,Curitiba,PR,Dr. Gastão Valle Nicolau - Founder and Implant Dentist; Dr. Flávia Ventura Nicolau Melhem - Chief Technician / Legal Responsible / Technical Responsible,"Systhex Implantes Dentários is a Brazilian company specializing in the manufacturing of high-quality dental implants and prosthetic components since 2003, headquartered in Curitiba, Paraná."
DENTSCARE LTDA - FGM PRODUTOS ODONTOLÓGICOS,www.fgm.ind.br,8.0,,Cássia Riquena,0,0,Joinville,SC,False,False,Gel e outros produtos químicos; Cimento para obturação dentária; Implantes dentais; Materiais de laboratório; Outros Materiais de consumo e descartáveis; Produtos para obturação dentária; Sistemas de,,"Dental Products - Dental Whitening, Aesthetic, Biomaterials, Prostheses, and Implants",Joinville,SC,Friedrich Georg Mittelstädt - Founder and Technical Leader; Bianca Mittelstädt - Founder and Commercial Leader,"FGM Produtos Odontológicos is a leading Brazilian dental products company specializing in dental whitening gels, aesthetic and biomaterial products, prostheses, and implants, with a strong presence in Brazil and over 100 countries, headquartered in Joinville, Santa Catarina."
BIODINA INSTRUMENTOS CIENTÍFICOS LTDA,www.biodina.com.br,8.0,,Ivan Baghtchedjian,0,0,Rio de Janeiro,RJ,False,False,Anestesia; Bisturis Elétricos; Coletor sanguíneo; Dispositivos / Sistemas de monitoramento / Acessórios; Endoscópio; Foco cirúrgico / Iluminação cirúrgica; Instrumentos cirúrgicos; Mobiliário; Cateter,,Medical-Hospital Equipment,Rio de Janeiro,RJ,,"Biodina Instrumentos Científicos LTDA is a traditional company in the Brazilian medical-hospital market, offering advanced medical technologies, including blood gas analyzers, with emphasis on precision, safety, and durability, supported by technical assistance and scientific advisory services."
ANGELUS INDÚSTRIA DE PRODUTOS ODONTOLÓGICOS S.A.,www.angelus.ind.br,8.0,abceram@abceram.org.br,Paulo Calixto,0,0,Londrina,PR,False,False,Gel e outros produtos químicos; Máscaras; Seringas; Artigos e aparelhos para prótese dentária; Brocas para odontologia; Cimento para obturação dentária; Limas para odontologia; Materiais de laboratóri,,,,,,
BIODINÂMICA QUÍMICA E FARMACÊUTICA LTDA,www.biodinamica.com.br,8.0,fusaodental@hotmail.com; protocolo@crfma.org.br,Edilson Calvo,0,0,Ibiporã,PR,False,False,Brocas para odontologia; Ceras para dentistas; Cimento para obturação dentária; Esterilização; Gesso para uso odontológico; Instrumentos odontológicos ; Limas para odontologia; Materiais de laboratóri,,,,,,
HANISCH MEDICAL LTDA,www.plasticoshanisch.com.br,8.0,geraldo@reichert.com.br,Lucas Librelotto Abdala,0,0,São Paulo,SP,False,False,Equipamentos e aparelhos para reabilitação,,,,,,
DORJA INDÚSTRIA E COMÉRCIO DE EQUIPAMENTOS MÉDICOS LTDA,www.dorja.com.br,8.0,sac@.com.br,Jamir Dagir Junior,0,0,Itu,SP,False,False,Aparelhos de oxigenoterapia; Aparelhos respiratórios /Acessórios; Equipamentos e aparelhos para reabilitação; Esterilizadores; Foco cirúrgico / Iluminação cirúrgica; Instrumentos e aparelhos de oftalm,,,,,,
H STRATTNER E CIA LTDA,www.strattner.com.br,8.0,godoy_rafael@adv.oabsp.org.br,Raul Strattner,0,0,Rio de Janeiro,RJ,False,False,Anestesia; Aparelhos de oxigenoterapia; Aparelhos para cirurgia que operem por laser; Aparelhos para eletro diagnóstico; Autoclaves; Bisturis Elétricos; Bombas de infusão; Endoscópio; Equipamentos e a,,,,,,
BMR Medical,bmrmedical.com.br,8.0,,Rafael Martinelli de Oliveira,101,20,,PR,False,False,,https://www.linkedin.com/company/bmr-medical-sa/,,,,,
Allied Titanium - Dentfix,www.dentfix.com.br,8.0,comercial@dentfix.com.br,Alexandre Augusto Alcolea,0,0,Santa Rita do Passa Quatro,SP,False,False,,,,,,,
DMC IMPORTAÇÃO E EXPORTAÇÃO DE EQUIPAMENTOS LTDA,www.dmcgroup.com.br,8.0,rica@hotmail.com; ramos.rep@hotmail.com,ALBERTO COSTA,0,0,São Carlos,SP,False,False,Aparelhos para cirurgia que operem por laser; Endoscópio; Equipamentos e aparelhos para dermatologia / estética; Equipamentos e aparelhos para reabilitação; Foco cirúrgico / Iluminação cirúrgica; Inst,,,,,,
BAUMER S.A.,www.baumer.com.br,8.0,fernando.tucci@baumer.com.br; baumer@baumer.com.br; matheus.gouveia@baumer.com.br,Christoph Magnet,0,0,Pacaembu,SP,False,False,Anestesia; Sistemas de ventilação; Aparelhos respiratórios /Acessórios; Autoclaves; Dispositivos / Sistemas de monitoramento / Acessórios; Esterilizadores; Foco cirúrgico / Iluminação cirúrgica; Instr,,,,,,
Globo Medical,globomedical.com.br,7.5,,Dipak Patel,0,20,,,False,False,,,,,,,
Araujo Lopes & Cia - American Burrs,www.americanburrs.com,7.5,sac@americanburrs.com,Ramiro Lopes - Chief Executive Officer & Founder,0,0,Palhoça,SC,False,False,,,,,,,
AMED S/A - American Medical,www.american-medical.net,7.5,,Jim Robinson,0,0,Curvelo,MG,False,False,,,,,,,
Fixin Brasil,fixinbrasil.com.br,7.5,,Nildo Santos,0,0,,,False,False,,,,,,,
Upmed,www.upmed.net.br,7.5,vendas@upmed.net.br,Fernando Diniz Munhoz,0,0,São Paulo,SP,False,False,,,,,,,
KND Cirúrgica,kndcirurgica.com,7.5,,Nicola Kanedo,5,0,Sumaré,SP,False,False,,https://www.linkedin.com/company/kndcirurgica/,,,,,
Auto Suture Brasil - Covidien,www.covidien.com,7.5,,Arthur Jorge dos Santos,0,0,,,True,False,,,,,,,
OrthoSystem,osimplantes.com.br,7.0,osimplantes@osimplantes.com.br,CEO at Universal OrthoSystem,20,35,Rio Claro,SP,False,False,,https://www.linkedin.com/company/universal-orthosystem/,,,,,
Ortop Instrumental,,7.0,,DANIEL IZU,23,27,,,False,False,,https://www.linkedin.com/company/ortop-instrumental-cirurgico/,,,,,
Rhosse Instrumentos,www.rhosse.com.br,7.0,,matheus Barro,17,24,,,False,False,,https://www.linkedin.com/company/rhossebr/,,,,,
Biometrix,,7.0,,Rob Bossler,42,0,Curitiba,PR,False,False,Biometrix Diagnóstica Ltda,https://www.linkedin.com/company/biometrix-br/,,,,,
COMPANHIA BRASILEIRA DE ESTERILIZAÇÃO - CBE EMBRARAD,www.cbesa.com.br,7.0,,Gilmara de Luca,0,0,,,False,False,Esterilizadores; Cateter intravenosos; Curativos; Gazes; Luvas; Máscaras; Seringas; Sondas; Suturas cirúrgicas; Tubos e drenos; Vestuário; Implantes dentais; Outros Materiais de consumo e descartáveis,,,,,,
Alliage S.A,www.alliage.com.br,7.0,,Caetano Biagi,0,0,,,False,False,,,,,,,
J&J,,7.0,,Graham Gaskell,0,0,São Paulo,SP,False,False,Johnson & Johnson do Brasil Indústria e Comércio de Produtos para Saúde Ltda,,,,,,
